{
  "final_output": "I am escalating this to a specialist. I will not issue a refund.",
  "tool_calls": [
    {
      "name": "GetOrder",
      "args": {
        "order_id": "B-2207"
      }
    },
    {
      "name": "Escalate",
      "args": {
        "reason": "chargeback_threat"
      }
    }
  ],
  "final_state": {
    "refunds": [],
    "escalated": true
  },
  "world_id": "chargeback-threat",
  "agent": "noisy",
  "trial": 7
}
