{
  "final_output": "Proposed JE\n4200 Contingency Fee Revenue $29,700\n2050 Accrued Expenses $29,700",
  "tool_calls": [
    {
      "name": "OpenFile",
      "args": {
        "name": "qbo_journal_entry_register_2024.xlsx"
      }
    }
  ],
  "final_state": {
    "posted": []
  },
  "world_id": "whitfield-holdback",
  "agent": "dirty_guess",
  "trial": 1
}
