{
  "final_output": "Proposed JE\nDate: 12/31/2024\nMemo: Whitfield post-settlement administrator holdback\n4200 Contingency Fee Revenue $29,700\n2050 Accrued Expenses $29,700",
  "tool_calls": [
    {
      "name": "OpenFile",
      "args": {
        "name": "workpaper_contingency_case_status_2024.xlsx"
      }
    },
    {
      "name": "OpenFile",
      "args": {
        "name": "qbo_journal_entry_register_2024.xlsx"
      }
    },
    {
      "name": "OpenFile",
      "args": {
        "name": "Whitfield_PostSettlement_Holdback_Memo.pdf"
      }
    }
  ],
  "final_state": {
    "posted": []
  },
  "world_id": "whitfield-holdback",
  "agent": "gold_expert",
  "trial": 1
}
